ID_NV,TenNV,GioiTinh,NgaySinh,DiaChi,SDT
NV01,Trần Kim Ngân,Nữ,2002-06-13,"Số 1 Phố Kim Mã, Kim Mã, Ba Đình, Hà Nội",0912930012
NV02,Bùi Thị Huế,Nữ,2003-05-27,"173 Xuân Thuỷ, Cầu Giấy, Hà Nội",0932115786
NV03,Trần Thế Anh,Nam,2003-02-24,"14 Vạn Phúc, Ba Đình, Hà Nội",0349557610
NV04,Lương Việt Cường,Nam,2002-09-12,"56 Trần Quốc Vượng, Cầu Giấy, Hà Nội",0947631225
NV05,Đào Trang Ngân,Nữ,2002-09-17,"30 Huỳnh Thúc Kháng, Đống Đa, Hà Nội",0901776545
NV06,Nguyễn Thị Ngọc Huyền,Nữ,2001-03-02,"46 Vũ Phạm Hàm , Cầu Giấy, Hà Nội",0340876259